complaint_id,part,status,title,text,user_id,released_time,views,total_pros,total_cons
1,전기 서비스,접수,전력 공급 장애,"오늘 아침부터 전기 공급이 멈췄습니다. 빨리 해결해주세요.",1,2023-07-27 12:00:00,100,20,5
2,수도 서비스,해결,수도 누수,"집 주변에서 물 누수가 발생하고 있습니다. 이 문제를 해결해주세요.",2,2023-07-27 12:00:00,150,10,2
3,전기 서비스,접수,전기 요금 이상,"이번 달 전기 요금이 이상하게 높습니다. 확인 부탁드립니다.",3,2023-07-27 12:00:00,200,30,8
4,수도 서비스,해결,물 안 나오는 문제,"수도관에서 물이 안 나오고 있습니다. 가능한 빨리 조치해주세요.",1,2023-07-27 12:00:00,80,15,3
5,전기 서비스,접수,전기 콘센트 파손,"집 안의 콘센트가 파손되어 전기 사용이 불편합니다.",2,2023-07-27 12:00:00,120,25,6

